URL,Version,Status,OIDs,Name,Title,Description,Used
http://dicom.nema.org/resources/ontology/DCM,01,active,,DICOM Controlled Terminology Definitions,,"DICOM Code Definitions (Coding Scheme Designator ""DCM"" Coding Scheme Version ""01"")","ValueSet/dicm-405-mediatype,ValueSet/audit-event-sub-type,ValueSet/security-role-type,ValueSet/audit-event-type"
http://hl7.org/fhir/action-cardinality-behavior,3.0.2,draft,"2.16.840.1.113883.4.642.1.791",ActionCardinalityBehavior,,"Defines behavior for an action or a group for how many times that item may be repeated","ValueSet/action-cardinality-behavior"
http://hl7.org/fhir/action-condition-kind,3.0.2,draft,"2.16.840.1.113883.4.642.1.799",ActionConditionKind,,"Defines the kinds of conditions that can appear on actions","ValueSet/action-condition-kind"
http://hl7.org/fhir/action-grouping-behavior,3.0.2,draft,"2.16.840.1.113883.4.642.1.783",ActionGroupingBehavior,,"Defines organization behavior of a group","ValueSet/action-grouping-behavior"
http://hl7.org/fhir/action-participant-type,3.0.2,draft,"2.16.840.1.113883.4.642.1.795",ActionParticipantType,,"The type of participant for the action","ValueSet/action-participant-type"
http://hl7.org/fhir/action-precheck-behavior,3.0.2,draft,"2.16.840.1.113883.4.642.1.789",ActionPrecheckBehavior,,"Defines selection frequency behavior for an action or group","ValueSet/action-precheck-behavior"
http://hl7.org/fhir/action-relationship-type,3.0.2,draft,"2.16.840.1.113883.4.642.1.797",ActionRelationshipType,,"Defines the types of relationships between actions","ValueSet/action-relationship-type"
http://hl7.org/fhir/action-required-behavior,3.0.2,draft,"2.16.840.1.113883.4.642.1.787",ActionRequiredBehavior,,"Defines requiredness behavior for selecting an action or an action group","ValueSet/action-required-behavior"
http://hl7.org/fhir/action-selection-behavior,3.0.2,draft,"2.16.840.1.113883.4.642.1.785",ActionSelectionBehavior,,"Defines selection behavior of a group","ValueSet/action-selection-behavior"
http://hl7.org/fhir/action-type,3.0.2,draft,"2.16.840.1.113883.4.642.1.793",ActionType,,"The type of action to be performed","ValueSet/action-type"
http://hl7.org/fhir/administrative-gender,3.0.2,draft,"2.16.840.1.113883.4.642.1.2",AdministrativeGender,,"The gender of a person used for administrative purposes.","ValueSet/administrative-gender"
http://hl7.org/fhir/allergy-clinical-status,3.0.2,draft,"2.16.840.1.113883.4.642.1.118",AllergyIntoleranceClinicalStatus,,"The clinical status of the allergy or intolerance.","ValueSet/allergy-clinical-status"
http://hl7.org/fhir/allergy-intolerance-category,3.0.2,draft,"2.16.840.1.113883.4.642.1.124",AllergyIntoleranceCategory,,"Category of an identified substance.","ValueSet/allergy-intolerance-category"
http://hl7.org/fhir/allergy-intolerance-criticality,3.0.2,draft,"2.16.840.1.113883.4.642.1.120",AllergyIntoleranceCriticality,,"Estimate of the potential clinical harm, or seriousness, of a reaction to an identified substance.","ValueSet/allergy-intolerance-criticality"
http://hl7.org/fhir/allergy-intolerance-type,3.0.2,draft,"2.16.840.1.113883.4.642.1.122",AllergyIntoleranceType,,"Identification of the underlying physiological mechanism for a Reaction Risk.","ValueSet/allergy-intolerance-type"
http://hl7.org/fhir/allergy-verification-status,3.0.2,draft,"2.16.840.1.113883.4.642.1.116",AllergyIntoleranceVerificationStatus,,"Assertion about certainty associated with a propensity, or potential risk, of a reaction to the identified substance.","ValueSet/allergy-verification-status"
http://hl7.org/fhir/animal-genderstatus,3.0.2,draft,"2.16.840.1.113883.4.642.1.408",GenderStatus,,"This example value set defines a set of codes that can be used to indicate the current state of the animal's reproductive organs.","ValueSet/animal-genderstatus"
http://hl7.org/fhir/audit-entity-type,3.0.2,draft,"2.16.840.1.113883.4.642.1.903",AuditEventEntityType,,"Code for the entity type involved in the audit event.","ValueSet/audit-entity-type"
http://hl7.org/fhir/audit-event-action,3.0.2,draft,"2.16.840.1.113883.4.642.1.446",AuditEventAction,,"Indicator for type of action performed during the event that generated the event","ValueSet/audit-event-action"
http://hl7.org/fhir/audit-event-outcome,3.0.2,draft,"2.16.840.1.113883.4.642.1.448",AuditEventOutcome,,"Indicates whether the event succeeded or failed","ValueSet/audit-event-outcome"
http://hl7.org/fhir/audit-event-type,20150326,active,"2.16.840.1.113883.4.642.1.456",Audit Event ID,,"Event Types for Audit Events - defined by DICOM with some FHIR specific additions.","ValueSet/audit-event-type"
http://hl7.org/fhir/composition-status,3.0.2,draft,"2.16.840.1.113883.4.642.1.237",CompositionStatus,,"The workflow/clinical status of the composition.","ValueSet/composition-status"
http://hl7.org/fhir/condition-clinical,3.0.2,draft,"2.16.840.1.113883.4.642.1.156",Condition Clinical Status Codes,,"Preferred value set for Condition Clinical Status.","ValueSet/condition-clinical"
http://hl7.org/fhir/condition-ver-status,3.0.2,draft,"2.16.840.1.113883.4.642.1.158",ConditionVerificationStatus,,"The verification status to support or decline the clinical status of the condition or diagnosis.","ValueSet/condition-ver-status"
http://hl7.org/fhir/consent-data-meaning,3.0.2,draft,"2.16.840.1.113883.4.642.1.744",ConsentDataMeaning,,"How a resource reference is interpreted when testing consent restrictions","ValueSet/consent-data-meaning"
http://hl7.org/fhir/consent-except-type,3.0.2,draft,"2.16.840.1.113883.4.642.1.742",ConsentExceptType,,"How an exception statement is applied, such as adding additional consent or removing consent","ValueSet/consent-except-type"
http://hl7.org/fhir/consent-state-codes,3.0.2,draft,"2.16.840.1.113883.4.642.1.740",ConsentState,,"Indicates the state of the consent","ValueSet/consent-state-codes"
http://hl7.org/fhir/consentaction,3.0.2,draft,"2.16.840.1.113883.4.642.1.738",Consent Action Codes,,"This value set includes sample Consent Action codes.","ValueSet/consent-action"
http://hl7.org/fhir/consentcategorycodes,3.0.2,draft,"2.16.840.1.113883.4.642.1.736",Consent Category Codes,,"This value set includes sample Consent Directive Type codes, including several consent directive related LOINC codes; HL7 VALUE SET: ActConsentType(2.16.840.1.113883.1.11.19897); examples of US realm consent directive legal descriptions and references to online and/or downloadable forms such as the SSA-827 Authorization to Disclose Information to the Social Security Administration; and other anticipated consent directives related to participation in a clinical trial, medical procedures, reproductive procedures; health care directive (Living Will); advance directive, do not resuscitate (DNR); Physician Orders for Life-Sustaining Treatment (POLST)","ValueSet/consent-category"
http://hl7.org/fhir/contactentity-type,3.0.2,draft,"2.16.840.1.113883.4.642.1.406",ContactEntityType,,"This example value set defines a set of codes that can be used to indicate the purpose for which you would contact a contact party.","ValueSet/contactentity-type"
http://hl7.org/fhir/data-absent-reason,3.0.2,draft,"2.16.840.1.113883.4.642.1.6",DataAbsentReason,,"Used to specify why the normally expected content of the data element is missing.","ValueSet/observation-valueabsentreason"
http://hl7.org/fhir/days-of-week,3.0.2,draft,"2.16.840.1.113883.4.642.1.507",DaysOfWeek,,"The days of the week.","ValueSet/days-of-week"
http://hl7.org/fhir/definition-topic,3.0.2,draft,"2.16.840.1.113883.4.642.1.778",DefinitionTopic,,"High-level categorization of the definition, used for searching, sorting, and filtering","ValueSet/definition-topic"
http://hl7.org/fhir/dicom-audit-lifecycle,20100826,active,,DICOM Audit Message Record Lifecycle Events,,"Attached is vocabulary for the record lifecycle events, as per DICOM Audit Message, ","ValueSet/object-lifecycle-events"
http://hl7.org/fhir/document-reference-status,3.0.2,draft,"2.16.840.1.113883.4.642.1.8",DocumentReferenceStatus,,"The status of the document reference.","ValueSet/document-reference-status"
http://hl7.org/fhir/document-relationship-type,3.0.2,draft,"2.16.840.1.113883.4.642.1.240",DocumentRelationshipType,,"The type of relationship between documents.","ValueSet/document-relationship-type"
http://hl7.org/fhir/endpoint-connection-type,3.0.2,draft,"2.16.840.1.113883.4.642.1.492",Endpoint Connection Type,,"This is an example value set defined by the FHIR project, that could be used to represent possible connection type profile values.","ValueSet/endpoint-connection-type"
http://hl7.org/fhir/endpoint-payload-type,3.0.2,draft,"2.16.840.1.113883.4.642.1.490",Endpoint Payload Type,,"This is an example value set defined by the FHIR project, that could be used to represent possible payload document types.","ValueSet/endpoint-payload-type"
http://hl7.org/fhir/endpoint-status,3.0.2,draft,"2.16.840.1.113883.4.642.1.488",EndpointStatus,,"The status of the endpoint","ValueSet/endpoint-status"
http://hl7.org/fhir/event-status,3.0.2,draft,"2.16.840.1.113883.4.642.1.101",EventStatus,,"Codes identifying the stage lifecycle stage of a event","ValueSet/event-status"
http://hl7.org/fhir/extra-security-role-type,3.0.2,draft,,SecurityRoleType,,"This CodeSystem contains Additional FHIR-defined Security Role types not defined elsewhere","ValueSet/security-role-type"
http://hl7.org/fhir/flag-status,3.0.2,draft,"2.16.840.1.113883.4.642.1.111",FlagStatus,,"Indicates whether this flag is active and needs to be displayed to a user, or whether it is no longer needed or entered in error.","ValueSet/flag-status"
http://hl7.org/fhir/goal-category,3.0.2,draft,"2.16.840.1.113883.4.642.1.271",GoalCategory,,"Example codes for grouping goals for filtering or presentation.","ValueSet/goal-category"
http://hl7.org/fhir/goal-priority,3.0.2,draft,"2.16.840.1.113883.4.642.1.269",GoalPriority,,"Indicates the level of importance associated with reaching or sustaining a goal.","ValueSet/goal-priority"
http://hl7.org/fhir/identifier-type,3.0.2,draft,"2.16.840.1.113883.4.642.1.45",Identifier Type Codes,,"A coded type for an identifier that can be used to determine which identifier to use for a specific purpose.","ValueSet/identifier-type"
http://hl7.org/fhir/identifier-use,3.0.2,draft,"2.16.840.1.113883.4.642.1.53",IdentifierUse,,"Identifies the purpose for this identifier, if known .","ValueSet/identifier-use"
http://hl7.org/fhir/immunization-origin,3.0.2,draft,"2.16.840.1.113883.4.642.1.294",Immunization Origin Codes,,"The value set to instantiate this attribute should be drawn from a terminologically robust code system that consists of or contains concepts to support describing the source of the data when the report of the immunization event is not based on information from the person, entity or organization who administered the vaccine. This value set is provided as a suggestive example.","ValueSet/immunization-origin"
http://hl7.org/fhir/iso-21089-lifecycle,null,active,,ISO 21089-2017 Health Record Lifecycle Events,,"Attached is vocabulary for the 27 record lifecycle events, as per ISO TS 21089-2017, Health Informatics - Trusted End-to-End Information Flows, Section 3, Terms and Definitions (2017, at ISO Central Secretariat, passed ballot and ready for publication).  This will also be included in the FHIR EHR Record Lifecycle Event Implementation Guide, balloted and (to be) published with FHIR STU-3.","ValueSet/object-lifecycle-events"
http://hl7.org/fhir/link-type,3.0.2,draft,"2.16.840.1.113883.4.642.1.413",LinkType,,"The type of link between this patient resource and another patient resource.","ValueSet/link-type"
http://hl7.org/fhir/medication-admin-status,3.0.2,draft,"2.16.840.1.113883.4.642.1.331",MedicationAdministrationStatus,,"A set of codes indicating the current status of a MedicationAdministration.","ValueSet/immunization-status"
http://hl7.org/fhir/medication-request-category,3.0.2,draft,"2.16.840.1.113883.4.642.1.349",MedicationRequestCategory,,"A coded concept identifying where the medication ordered is expected to be consumed or administered","ValueSet/medication-request-category"
http://hl7.org/fhir/medication-request-intent,3.0.2,draft,"2.16.840.1.113883.4.642.1.346",MedicationRequestIntent,,"The kind of medication order","ValueSet/medication-request-intent"
http://hl7.org/fhir/medication-request-priority,3.0.2,draft,"2.16.840.1.113883.4.642.1.351",MedicationRequestPriority,,"Identifies the level of importance to be assigned to actioning the request","ValueSet/medication-request-priority"
http://hl7.org/fhir/medication-request-status,3.0.2,draft,"2.16.840.1.113883.4.642.1.344",MedicationRequestStatus,,"A coded concept specifying the state of the prescribing event. Describes the lifecycle of the prescription","ValueSet/medication-request-status"
http://hl7.org/fhir/medication-statement-category,3.0.2,draft,"2.16.840.1.113883.4.642.1.356",MedicationStatementCategory,,"A coded concept identifying where the medication included in the medicationstatement is expected to be consumed or administered","ValueSet/medication-statement-category"
http://hl7.org/fhir/medication-statement-status,3.0.2,draft,"2.16.840.1.113883.4.642.1.353",MedicationStatementStatus,,"A coded concept indicating the current status of a MedicationStatement.","ValueSet/medication-statement-status"
http://hl7.org/fhir/medication-statement-taken,3.0.2,draft,"2.16.840.1.113883.4.642.1.358",MedicationStatementTaken,,"A coded concept identifying level of certainty if patient has taken or has not taken the medication","ValueSet/medication-statement-taken"
http://hl7.org/fhir/name-assembly-order,3.0.2,draft,"2.16.840.1.113883.4.642.1.833",HumanNameAssemblyOrder,,"A code that represents the preferred display order of the components of a human name","ValueSet/name-assembly-order"
http://hl7.org/fhir/name-use,3.0.2,draft,"2.16.840.1.113883.4.642.1.59",NameUse,,"The use of a human name","ValueSet/name-use"
http://hl7.org/fhir/network-type,3.0.2,draft,"2.16.840.1.113883.4.642.1.450",AuditEventAgentNetworkType,,"The type of network access point of this agent in the audit event","ValueSet/network-type"
http://hl7.org/fhir/object-role,3.0.2,draft,"2.16.840.1.113883.4.642.1.454",AuditEventEntityRole,,"Code representing the role the entity played in the audit event","ValueSet/object-role"
http://hl7.org/fhir/observation-category,3.0.2,draft,"2.16.840.1.113883.4.642.1.393",Observation Category Codes,,"Observation Category codes.","ValueSet/observation-category"
http://hl7.org/fhir/observation-relationshiptypes,3.0.2,draft,"2.16.840.1.113883.4.642.1.390",ObservationRelationshipType,,"Codes specifying how two observations are related.","ValueSet/observation-relationshiptypes"
http://hl7.org/fhir/observation-status,3.0.2,draft,"2.16.840.1.113883.4.642.1.388",ObservationStatus,,"Codes providing the status of an observation.","ValueSet/observation-status"
http://hl7.org/fhir/organization-type,3.0.2,draft,"2.16.840.1.113883.4.642.1.404",OrganizationType,,"This example value set defines a set of codes that can be used to indicate a type of organization.","ValueSet/organization-type"
http://hl7.org/fhir/plan-definition-type,3.0.2,draft,"2.16.840.1.113883.4.642.1.781",PlanDefinitionType,,"The type of PlanDefinition","ValueSet/plan-definition-type"
http://hl7.org/fhir/practitioner-role,3.0.2,draft,"2.16.840.1.113883.4.642.1.431",PractitionerRole,,"This example value set defines a set of codes that can be used to indicate the role of a Practitioner.","ValueSet/practitioner-role"
http://hl7.org/fhir/publication-status,3.0.2,draft,"2.16.840.1.113883.4.642.1.4",PublicationStatus,,"The lifecycle status of a Value Set or Concept Map.","ValueSet/publication-status"
http://hl7.org/fhir/quantity-comparator,3.0.2,draft,"2.16.840.1.113883.4.642.1.55",QuantityComparator,,"How the Quantity should be understood and represented.","ValueSet/quantity-comparator"
http://hl7.org/fhir/reaction-event-severity,3.0.2,draft,"2.16.840.1.113883.4.642.1.126",AllergyIntoleranceSeverity,,"Clinical assessment of the severity of a reaction event as a whole, potentially considering multiple different manifestations.","ValueSet/reaction-event-severity"
http://hl7.org/fhir/referencerange-meaning,3.0.2,draft,"2.16.840.1.113883.4.642.1.385",Observation Reference Range Meaning Codes,,"This value set defines a set of codes that can be used to indicate the meaning/use of a reference range for a particular target population.","ValueSet/referencerange-meaning"
http://hl7.org/fhir/resource-types,3.0.2,draft,,ResourceType,,"One of the resource types defined as part of FHIR.","ValueSet/audit-entity-type,ValueSet/consent-content-class"
http://hl7.org/fhir/restful-interaction,null,draft,,FHIR Restful Interactions,,"The set of interactions defined by the RESTful part of the FHIR specification.","ValueSet/audit-event-sub-type"
http://hl7.org/fhir/security-source-type,20100826,active,"2.16.840.1.113883.4.642.1.460",Audit Event Source Type,,"The type of process where the audit event originated from.","ValueSet/audit-source-type"
http://hl7.org/fhir/sid/cvx,4.0.0,active,"2.16.840.1.113883.12.292",CVX,Vaccine Administered Code Set (CVX),"The CDC's National Center of Immunization and Respiratory Diseases (NCIRD - see [https://www.cdc.gov/ncird/](https://www.cdc.gov/ncird/)) developed and maintains the CVX (vaccine administered) code set. It includes both active and inactive vaccines available in the US. CVX codes for inactive vaccines allow transmission of historical immunization records. When a MVX (manufacturer) code is paired with a CVX (vaccine administered) code, the specific trade named vaccine may be indicated. These codes should be used for immunization messages using either HL7 Version 2.3.1 or HL7 Version 2.5.1. CVX is the underlying Master Code System for V2 table 0292 (Vaccines Administered). The machine readable name for CVX in PHIN VADS is PH_VaccinesAdministeredCVX_CDC_NIP. The version of the CVX code set for certification can be found on the archive page:[https://www2a.cdc.gov/vaccines/iis/iisstandards/mu3versioned_codes.asp](https://www2a.cdc.gov/vaccines/iis/iisstandards/mu3versioned_codes.asp)     The Status column indicates if the vaccine is currently available in the United States.    *  Active: A currently available administrable vaccine     *  Inactive: An administrable vaccine formulation that is no longer available for patient administration, but can be found in historical patient records OR A historical record of a vaccine administered where the exact formulation is unknown     *  Pending: A vaccine that is expected to become active in the future     *  Non-US: A vaccine that available outside the US only     *  Never Active: A vaccine that was never available and is not in the pipeline of new vaccines     The Last Updated column indicates the last time this particular vaccine code was updated in this table.    Questions regarding this table should be directed to the IIS Technical Assistance Team via iisinfo@cdc.gov (or use mailing address via [https://www2a.cdc.gov/vaccines/iis/iisstandards/vaccines.asp?rpt=cvx#addr](https://www2a.cdc.gov/vaccines/iis/iisstandards/vaccines.asp?rpt=cvx#addr))     HL7 Implementers should note that 'Status' IS NOT CONCEPT STATUS as all codes are ACTIVE in this code system.    The current code system is available via [https://www2a.cdc.gov/vaccines/iis/iisstandards/vaccines.asp?rpt=cvx](https://www2a.cdc.gov/vaccines/iis/iisstandards/vaccines.asp?rpt=cvx)","ValueSet/vaccine-code"
http://hl7.org/fhir/sid/icd-10-nl,2.1.1,retired,"2.16.840.1.113883.6.3.2",ICD10dut,ICD10, Dutch Translation,"Hirs, W., H.W. Becker, C. van Boven, S.K. Oskam, I.M. Okkes, H. Lamberts. ICD-10, Dutch Translation, 200403. Amsterdam: Department of General Practice, Academic Medical Center/University of Amsterdam, Dutch College of General Practitioners (NHG), March 20","ValueSet/ProbleemNaamCodelist"
http://hl7.org/fhir/sid/icpc-1-nl,1.12.0,active,"2.16.840.1.113883.2.4.4.31.1",ICPC-1,ICPC-1 NL,"Op basis van NHG-Tabel ICPC versie 10, april 2022 en ICPC-Thesaurus versie 2023 © NHG","ValueSet/ProbleemNaamCodelist"
http://hl7.org/fhir/specimen-status,3.0.2,draft,"2.16.840.1.113883.4.642.1.465",SpecimenStatus,,"Codes providing the status/availability of a specimen.","ValueSet/specimen-status"
http://hl7.org/fhir/v2/0078,2.8.2,active,"2.16.840.1.113883.18.31",v2 Interpretation Codes,,"FHIR Value set/code system definition for HL7 v2 table 0078 ( Interpretation Codes)","ValueSet/observation-interpretation"
http://hl7.org/fhir/v2/0131,2.8.2,active,"2.16.840.1.113883.18.58",v2 Contact Role,,"FHIR Value set/code system definition for HL7 v2 table 0131 ( Contact Role)","ValueSet/v2-0131"
http://hl7.org/fhir/v2/0203,2.8.2,active,"2.16.840.1.113883.18.108",v2 Identifier Type,,"FHIR Value set/code system definition for HL7 v2 table 0203 ( Identifier Type)","ValueSet/identifier-type"
http://hl7.org/fhir/v2/0360/2.7,0360,active,"2.16.840.1.113883.18.220",v2 table 0360, Version 2.7,,"v2 table definition for v2 table 0360, Version 2.7","ValueSet/v2-2.7-0360"
http://hl7.org/fhir/v2/0371,2.8.2,active,"2.16.840.1.113883.18.229",v2 Additive/Preservative,,"FHIR Value set/code system definition for HL7 v2 table 0371 ( Additive/Preservative)","ValueSet/v2-0371"
http://hl7.org/fhir/v2/0373,2.8.2,active,"2.16.840.1.113883.18.231",v2 Treatment,,"FHIR Value set/code system definition for HL7 v2 table 0373 ( Treatment)","ValueSet/specimen-processing-procedure"
http://hl7.org/fhir/v2/0443,2.8.2,active,"2.16.840.1.113883.18.283",v2 Provider Role,,"FHIR Value set/code system definition for HL7 v2 table 0443 ( Provider Role)","ValueSet/immunization-role"
http://hl7.org/fhir/v2/0444,2.8.2,active,"2.16.840.1.113883.18.284",v2 Name Assembly Order,,"FHIR Value set/code system definition for HL7 v2 table 0444 ( Name Assembly Order)","ValueSet/name-assembly-order"
http://hl7.org/fhir/v3/ActCode,2016-11-11,active,"2.16.840.1.113883.5.4",v3 Code System ActCode,," A code specifying the particular kind of Act that the Act-instance represents within its class.  Constraints:  The kind of Act (e.g. physical examination, serum potassium, inpatient encounter, charge financial transaction, etc.) is specified with a code from one of several, typically external, coding systems.  The coding system will depend on the class of Act, such as LOINC for observations, etc. Conceptually, the Act.code must be a specialization of the Act.classCode. This is why the structure of ActClass domain should be reflected in the superstructure of the ActCode domain and then individual codes or externally referenced vocabularies subordinated under these domains that reflect the ActClass structure. Act.classCode and Act.code are not modifiers of each other but the Act.code concept should really imply the Act.classCode concept. For a negative example, it is not appropriate to use an Act.code ""potassium"" together with and Act.classCode for ""laboratory observation"" to somehow mean ""potassium laboratory observation"" and then use the same Act.code for ""potassium"" together with Act.classCode for ""medication"" to mean ""substitution of potassium"". This mutually modifying use of Act.code and Act.classCode is not permitted.","ValueSet/v3-ActCode"
http://hl7.org/fhir/v3/ActReason,2016-11-11,active,"2.16.840.1.113883.5.8",v3 Code System ActReason,," A set of codes specifying the motivation, cause, or rationale of an Act, when such rationale is not reasonably represented as an ActRelationship of type ""has reason"" linking to another Act.  Examples:  Example reasons that might qualify for being coded in this field might be: ""routine requirement"", ""infectious disease reporting requirement"", ""on patient request"", ""required by law"".","ValueSet/no-immunization-reason,ValueSet/v3-PurposeOfUse,ValueSet/v3-SubstanceAdminSubstitutionReason"
http://hl7.org/fhir/v3/ActSite,2016-11-11,active,"2.16.840.1.113883.5.1052",v3 Code System ActSite,," An anatomical location on an organism which can be the focus of an act.","ValueSet/immunization-site"
http://hl7.org/fhir/v3/ActStatus,2016-11-11,active,"2.16.840.1.113883.5.14",v3 Code System ActStatus,," Codes representing the defined possible states of an Act, as defined by the Act class state machine.","ValueSet/2.16.840.1.113883.2.4.3.11.60.40.2.8.2.3--20171231000000"
http://hl7.org/fhir/v3/AdministrativeGender,2016-11-11,active,"2.16.840.1.113883.5.1",v3 Code System AdministrativeGender,," The gender of a person used for adminstrative purposes (as opposed to clinical gender)","ValueSet/2.16.840.1.113883.2.4.3.11.60.40.2.0.1.1--20171231000000"
http://hl7.org/fhir/v3/EntityNamePartQualifier,2016-11-11,active,"2.16.840.1.113883.5.43",v3 Code System EntityNamePartQualifier,,"  OpenIssue:  Needs description","ValueSet/name-part-qualifier"
http://hl7.org/fhir/v3/EntityNamePartQualifierR2,2016-11-11,active,"2.16.840.1.113883.5.1122",v3 Code System EntityNamePartQualifierR2,,"  Description:  The qualifier is a set of codes each of which specifies a certain subcategory of the name part in addition to the main name part type. For example, a given name may be flagged as a nickname, a family name may be a pseudonym or a name of public records.","ValueSet/name-part-qualifier"
http://hl7.org/fhir/v3/LanguageAbilityMode,2016-11-11,active,"2.16.840.1.113883.5.60",v3 Code System LanguageAbilityMode,," A value representing the method of expression of the language.  Example:  Expressed spoken, expressed written, expressed signed, received spoken, received written, received signed.  OpenIssue:  Description copied from Concept Domain of same name.  Must be verified.","ValueSet/v3-LanguageAbilityMode"
